Year,Area,ANZSIC06,Measure,Value,Flags
"2018","Canterbury Region","Total Industry","Geographic Units",72237,
"2018","Canterbury Region","A Agriculture, Forestry and Fishing","Geographic Units",9843,
"2018","Canterbury Region","B Mining","Geographic Units",78,
"2018","Canterbury Region","F373 Furniture, Floor Coverings and Other Goods Wholesaling","Geographic Units",498,
"2018","Canterbury Region","J601 Libraries and Archives","Geographic Units",45,
"2018","Canterbury Region","J542 Software Publishing","Geographic Units",24,
"2018","Canterbury Region","G411 Supermarket and Grocery Stores","Geographic Units",438,
"2018","Canterbury Region","L661 Motor Vehicle and Transport Equipment Rental and Hiring","Geographic Units",270,
"2018","Canterbury Region","K642 Auxiliary Insurance Services","Geographic Units",333,
"2018","Canterbury Region","K622 Depository Financial Intermediation","Geographic Units",117,
"2018","Canterbury Region","S955 Civic, Professional and Other Interest Group Services","Geographic Units",555,
"2018","Canterbury Region","P821 Adult, Community and Other Education","Geographic Units",447,
"2018","Canterbury Region","O754 Justice","Geographic Units",6,
"2018","Canterbury Region","S952 Funeral, Crematorium and Cemetery Services","Geographic Units",72,
"2018","Canterbury Region","S953 Other Personal Services","Geographic Units",303,
"2018","Canterbury Region","S954 Religious Services","Geographic Units",192,
"2018","Canterbury Region","S942 Machinery and Equipment Repair and Maintenance","Geographic Units",327,
"2018","Canterbury Region","S949 Other Repair and Maintenance","Geographic Units",81,
"2018","Canterbury Region","S951 Personal Care Services","Geographic Units",627,
"2018","Canterbury Region","R913 Amusement and Other Recreation Activities","Geographic Units",156,
"2018","Canterbury Region","R920 Gambling Activities","Geographic Units",18,
"2018","Canterbury Region","S941 Automotive Repair and Maintenance","Geographic Units",1026,
"2018","Canterbury Region","R900 Creative and Performing Arts Activities","Geographic Units",261,
"2018","Canterbury Region","R911 Sport and Physical Recreation Activities","Geographic Units",663,
"2018","Canterbury Region","R912 Horse and Dog Racing Activities","Geographic Units",159,
"2018","Canterbury Region","Q879 Other Social Assistance Services","Geographic Units",228,
"2018","Canterbury Region","R891 Museum Operation","Geographic Units",30,
"2018","Canterbury Region","R892 Parks and Gardens Operations","Geographic Units",33,
"2018","Canterbury Region","Q859 Other Health Care Services","Geographic Units",123,
"2018","Canterbury Region","Q860 Residential Care Services","Geographic Units",246,
"2018","Canterbury Region","Q871 Child Care Services","Geographic Units",120,
"2018","Canterbury Region","Q851 Medical Services","Geographic Units",1026,
"2018","Canterbury Region","Q852 Pathology and Diagnostic Imaging Services","Geographic Units",36,
"2018","Canterbury Region","Q853 Allied Health Services","Geographic Units",1095,
"2018","Canterbury Region","P810 Tertiary Education","Geographic Units",78,
"2018","Canterbury Region","P822 Educational Support Services","Geographic Units",63,
"2018","Canterbury Region","Q840 Hospitals","Geographic Units",45,
"2018","Canterbury Region","O772 Regulatory Services","Geographic Units",63,
"2018","Canterbury Region","P801 Preschool Education","Geographic Units",378,
"2018","Canterbury Region","P802 School Education","Geographic Units",297,
"2018","Canterbury Region","O753 Local Government Administration","Geographic Units",69,
"2018","Canterbury Region","O760 Defence","Geographic Units",9,
"2018","Canterbury Region","O771 Public Order and Safety Services","Geographic Units",288,
"2018","Canterbury Region","N731 Building Cleaning, Pest Control and Gardening Services","Geographic Units",1047,
"2018","Canterbury Region","N732 Packaging and Labelling Services","Geographic Units",15,
"2018","Canterbury Region","O751 Central Government Administration","Geographic Units",60,
"2018","Canterbury Region","N721 Employment Services","Geographic Units",168,
"2018","Canterbury Region","N722 Travel Agency Services","Geographic Units",342,
"2018","Canterbury Region","N729 Other Administrative Services","Geographic Units",636,
"2018","Canterbury Region","M697 Veterinary Services","Geographic Units",138,
"2018","Canterbury Region","M699 Other Professional, Scientific and Technical Services","Geographic Units",225,
"2018","Canterbury Region","M700 Computer System Design and Related Services","Geographic Units",933,
"2018","Canterbury Region","M694 Advertising Services","Geographic Units",174,
"2018","Canterbury Region","M695 Market Research and Statistical Services","Geographic Units",30,
"2018","Canterbury Region","M696 Management and Related Consulting Services","Geographic Units",1983,
"2018","Canterbury Region","M691 Scientific Research Services","Geographic Units",99,
"2018","Canterbury Region","M692 Architectural, Engineering and Technical Services","Geographic Units",1926,
"2018","Canterbury Region","M693 Legal and Accounting Services","Geographic Units",948,
"2018","Canterbury Region","L664 Non-Financial Intangible Assets (Except Copyrights) Leasing","Geographic Units",135,
"2018","Canterbury Region","L671 Property Operators","Geographic Units",12618,
"2018","Canterbury Region","L672 Real Estate Services","Geographic Units",1419,
"2018","Canterbury Region","K641 Auxiliary Finance and Investment Services","Geographic Units",417,
"2018","Canterbury Region","L662 Farm Animal and Bloodstock Leasing","Geographic Units",171,
"2018","Canterbury Region","L663 Other Goods and Equipment Rental and Hiring","Geographic Units",375,
"2018","Canterbury Region","K631 Life Insurance","Geographic Units",6,
"2018","Canterbury Region","K632 Health and General Insurance","Geographic Units",27,
"2018","Canterbury Region","K633 Superannuation Funds","Geographic Units",27,
"2018","Canterbury Region","J602 Other Information Services","Geographic Units",0,
"2018","Canterbury Region","K623 Non-Depository Financing","Geographic Units",96,
"2018","Canterbury Region","K624 Financial Asset Investing","Geographic Units",3315,
"2018","Canterbury Region","J580 Telecommunications Services","Geographic Units",39,
"2018","Canterbury Region","J591 Internet Service Providers and Web Search Portals","Geographic Units",24,
"2018","Canterbury Region","J592 Data Processing, Web Hosting and Electronic Information Storage Services","Geographic Units",45,
"2018","Canterbury Region","J561 Radio Broadcasting","Geographic Units",15,
"2018","Canterbury Region","J562 Television Broadcasting","Geographic Units",6,
"2018","Canterbury Region","J570 Internet Publishing and Broadcasting","Geographic Units",12,
"2018","Canterbury Region","J541 Newspaper, Periodical, Book and Directory Publishing","Geographic Units",78,
"2018","Canterbury Region","J551 Motion Picture and Video Activities","Geographic Units",123,
"2018","Canterbury Region","J552 Sound Recording and Music Publishing","Geographic Units",15,
"2018","Canterbury Region","I522 Air Transport Support Services","Geographic Units",18,
"2018","Canterbury Region","I529 Other Transport Support Services","Geographic Units",159,
"2018","Canterbury Region","I530 Warehousing and Storage Services","Geographic Units",132,
"2018","Canterbury Region","I502 Pipeline and Other Transport","Geographic Units",48,
"2018","Canterbury Region","I510 Postal and Courier Pick-up and Delivery Services","Geographic Units",513,
"2018","Canterbury Region","I521 Water Transport Support Services","Geographic Units",33,
"2018","Canterbury Region","I482 Water Passenger Transport","Geographic Units",6,
"2018","Canterbury Region","I490 Air and Space Transport","Geographic Units",45,
"2018","Canterbury Region","I501 Scenic and Sightseeing Transport","Geographic Units",66,
"2018","Canterbury Region","I471 Rail Freight Transport","Geographic Units",6,
"2018","Canterbury Region","I472 Rail Passenger Transport","Geographic Units",0,
"2018","Canterbury Region","I481 Water Freight Transport","Geographic Units",6,
"2018","Canterbury Region","H453 Clubs (Hospitality)","Geographic Units",75,
"2018","Canterbury Region","I461 Road Freight Transport","Geographic Units",603,
"2018","Canterbury Region","I462 Road Passenger Transport","Geographic Units",555,
"2018","Canterbury Region","H440 Accommodation","Geographic Units",843,
"2018","Canterbury Region","H451 Cafes, Restaurants and Takeaway Food Services","Geographic Units",1944,
"2018","Canterbury Region","H452 Pubs, Taverns and Bars","Geographic Units",231,
"2018","Canterbury Region","G427 Pharmaceutical and Other Store-Based Retailing","Geographic Units",852,
"2018","Canterbury Region","G431 Non-Store Retailing","Geographic Units",234,
"2018","Canterbury Region","G432 Retail Commission-Based Buying and/or Selling","Geographic Units",81,
"2018","Canterbury Region","G424 Recreational Goods Retailing","Geographic Units",285,
"2018","Canterbury Region","G425 Clothing, Footwear and Personal Accessories Retailing","Geographic Units",669,
"2018","Canterbury Region","G426 Department Stores","Geographic Units",45,
"2018","Canterbury Region","G421 Furniture, Floor Coverings, Houseware and Textile Goods Retailing","Geographic Units",288,
"2018","Canterbury Region","G422 Electrical and Electronic Goods Retailing","Geographic Units",219,
"2018","Canterbury Region","G423 Hardware, Building and Garden Supplies Retailing","Geographic Units",225,
"2018","Canterbury Region","G392 Motor Vehicle Parts Retailing","Geographic Units",126,
"2018","Canterbury Region","G400 Fuel Retailing","Geographic Units",159,
"2018","Canterbury Region","G412 Specialised Food Retailing","Geographic Units",345,
"2018","Canterbury Region","F372 Pharmaceutical and Toiletry Goods Wholesaling","Geographic Units",45,
"2018","Canterbury Region","F380 Commission-Based Wholesaling","Geographic Units",195,
"2018","Canterbury Region","G391 Motor Vehicle Retailing","Geographic Units",366,
"2018","Canterbury Region","F350 Motor Vehicle and Motor Vehicle Parts Wholesaling","Geographic Units",273,
"2018","Canterbury Region","F360 Grocery, Liquor and Tobacco Product Wholesaling","Geographic Units",312,
"2018","Canterbury Region","F371 Textile, Clothing and Footwear Wholesaling","Geographic Units",138,
"2018","Canterbury Region","F333 Timber and Hardware Goods Wholesaling","Geographic Units",246,
"2018","Canterbury Region","F341 Specialised Industrial Machinery and Equipment Wholesaling","Geographic Units",258,
"2018","Canterbury Region","F349 Other Machinery and Equipment Wholesaling","Geographic Units",387,
"2018","Canterbury Region","E329 Other Construction Services","Geographic Units",720,
"2018","Canterbury Region","F331 Agricultural Product Wholesaling","Geographic Units",234,
"2018","Canterbury Region","F332 Mineral, Metal and Chemical Wholesaling","Geographic Units",186,
"2018","Canterbury Region","E322 Building Structure Services","Geographic Units",669,
"2018","Canterbury Region","E323 Building Installation Services","Geographic Units",1602,
"2018","Canterbury Region","E324 Building Completion Services","Geographic Units",1923,
"2018","Canterbury Region","E302 Non-Residential Building Construction","Geographic Units",258,
"2018","Canterbury Region","E310 Heavy and Civil Engineering Construction","Geographic Units",324,
"2018","Canterbury Region","E321 Land Development and Site Preparation Services","Geographic Units",591,
"2018","Canterbury Region","D291 Waste Collection Services","Geographic Units",81,
"2018","Canterbury Region","D292 Waste Treatment, Disposal and Remediation Services","Geographic Units",78,
"2018","Canterbury Region","E301 Residential Building Construction","Geographic Units",2889,
"2018","Canterbury Region","D264 On Selling Electricity and Electricity Market Operation","Geographic Units",6,
"2018","Canterbury Region","D270 Gas Supply","Geographic Units",3,
"2018","Canterbury Region","D281 Water Supply, Sewerage and Drainage Services","Geographic Units",27,
"2018","Canterbury Region","D261 Electricity Generation","Geographic Units",12,
"2018","Canterbury Region","D262 Electricity Transmission","Geographic Units",3,
"2018","Canterbury Region","D263 Electricity Distribution","Geographic Units",6,
"2018","Canterbury Region","C249 Other Machinery and Equipment Manufacturing","Geographic Units",363,
"2018","Canterbury Region","C251 Furniture Manufacturing","Geographic Units",210,
"2018","Canterbury Region","C259 Other Manufacturing","Geographic Units",141,
"2018","Canterbury Region","C244 Domestic Appliance Manufacturing","Geographic Units",6,
"2018","Canterbury Region","C245 Pump, Compressor, Heating and Ventilation Equipment Manufacturing","Geographic Units",12,
"2018","Canterbury Region","C246 Specialised Machinery and Equipment Manufacturing","Geographic Units",96,
"2018","Canterbury Region","C241 Professional and Scientific Equipment Manufacturing","Geographic Units",54,
"2018","Canterbury Region","C242 Computer and Electronic Equipment Manufacturing","Geographic Units",51,
"2018","Canterbury Region","C243 Electrical Equipment Manufacturing","Geographic Units",42,
"2018","Canterbury Region","C229 Other Fabricated Metal Product Manufacturing","Geographic Units",198,
"2018","Canterbury Region","C231 Motor Vehicle and Motor Vehicle Part Manufacturing","Geographic Units",102,
"2018","Canterbury Region","C239 Other Transport Equipment Manufacturing","Geographic Units",81,
"2018","Canterbury Region","C222 Structural Metal Product Manufacturing","Geographic Units",177,
"2018","Canterbury Region","C223 Metal Container Manufacturing","Geographic Units",12,
"2018","Canterbury Region","C224 Other Sheet Metal Product Manufacturing","Geographic Units",51,
"2018","Canterbury Region","C213 Basic Non-Ferrous Metal Manufacturing","Geographic Units",6,
"2018","Canterbury Region","C214 Basic Non-Ferrous Metal Product Manufacturing","Geographic Units",9,
"2018","Canterbury Region","C221  Iron and Steel Forging","Geographic Units",3,
"2018","Canterbury Region","C209 Other Non-Metallic Mineral Product Manufacturing","Geographic Units",24,
"2018","Canterbury Region","C211 Basic Ferrous Metal Manufacturing","Geographic Units",12,
"2018","Canterbury Region","C212 Basic Ferrous Metal Product Manufacturing","Geographic Units",9,
"2018","Canterbury Region","C201 Glass and Glass Product Manufacturing","Geographic Units",33,
"2018","Canterbury Region","C202 Ceramic Product Manufacturing","Geographic Units",9,
"2018","Canterbury Region","C203 Cement, Lime, Plaster and Concrete Product Manufacturing","Geographic Units",84,
"2018","Canterbury Region","C189 Other Basic Chemical Product Manufacturing","Geographic Units",12,
"2018","Canterbury Region","C191 Polymer Product Manufacturing","Geographic Units",99,
"2018","Canterbury Region","C192 Natural Rubber Product Manufacturing","Geographic Units",3,
"2018","Canterbury Region","C183 Fertiliser and Pesticide Manufacturing","Geographic Units",15,
"2018","Canterbury Region","C184 Pharmaceutical and Medicinal Product Manufacturing","Geographic Units",15,
"2018","Canterbury Region","C185 Cleaning Compound and Toiletry Preparation Manufacturing","Geographic Units",24,
"2018","Canterbury Region","C170 Petroleum Refining and Petroleum and Coal Product Manufacturing","Geographic Units",15,
"2018","Canterbury Region","C181 Chemical Manufacturing","Geographic Units",9,
"2018","Canterbury Region","C182 Basic Polymer Manufacturing","Geographic Units",12,
"2018","Canterbury Region","C152 Converted Paper Product Manufacturing","Geographic Units",15,
"2018","Canterbury Region","C161 Printing","Geographic Units",132,
"2018","Canterbury Region","C162 Reproduction of Recorded Media","Geographic Units",6,
"2018","Canterbury Region","C141 Log Sawmilling and Timber Dressing","Geographic Units",57,
"2018","Canterbury Region","C149 Other Wood Product Manufacturing","Geographic Units",225,
"2018","Canterbury Region","C151 Pulp, Paper and Paperboard Manufacturing","Geographic Units",6,
"2018","Canterbury Region","C133 Textile Product Manufacturing","Geographic Units",93,
"2018","Canterbury Region","C134 Knitted Product Manufacturing","Geographic Units",12,
"2018","Canterbury Region","C135 Clothing and Footwear Manufacturing","Geographic Units",75,
"2018","Canterbury Region","C122 Cigarette and Tobacco Product Manufacturing","Geographic Units",0,
"2018","Canterbury Region","C131 Textile Fibre, Yarn and Woven Fabric Manufacturing","Geographic Units",21,
"2018","Canterbury Region","C132 Leather Tanning and Fur Dressing","Geographic Units",18,
"2018","Canterbury Region","C118 Sugar and Confectionery Manufacturing","Geographic Units",9,
"2018","Canterbury Region","C119 Other Food Product Manufacturing","Geographic Units",120,
"2018","Canterbury Region","C121 Beverage Manufacturing","Geographic Units",96,
"2018","Canterbury Region","C115 Oil and Fat Manufacturing","Geographic Units",6,
"2018","Canterbury Region","C116 Grain Mill and Cereal Product Manufacturing","Geographic Units",12,
"2018","Canterbury Region","C117 Bakery Product Manufacturing","Geographic Units",144,
"2018","Canterbury Region","C112 Seafood Processing","Geographic Units",18,
"2018","Canterbury Region","C113 Dairy Product Manufacturing","Geographic Units",27,
"2018","Canterbury Region","C114 Fruit and Vegetable Processing","Geographic Units",18,
"2018","Canterbury Region","B101 Exploration","Geographic Units",6,
"2018","Canterbury Region","B109 Other Mining Support Services","Geographic Units",12,
"2018","Canterbury Region","C111 Meat and Meat Product Manufacturing","Geographic Units",54,
"2018","Canterbury Region","B080 Metal Ore Mining","Geographic Units",12,
"2018","Canterbury Region","B091 Construction Material Mining","Geographic Units",42,
"2018","Canterbury Region","B099 Other Non-Metallic Mineral Mining and Quarrying","Geographic Units",3,
"2018","Canterbury Region","A051  Forestry Support Services","Geographic Units",54,
"2018","Canterbury Region","A052 Agriculture and Fishing Support Services","Geographic Units",1086,
"2018","Canterbury Region","B060 Coal Mining","Geographic Units",3,
"2018","Canterbury Region","A030 Forestry and Logging","Geographic Units",432,
"2018","Canterbury Region","A041 Fishing","Geographic Units",150,
"2018","Canterbury Region","A042 Hunting and Trapping","Geographic Units",24,
"2018","Canterbury Region","A018 Deer Farming","Geographic Units",228,
"2018","Canterbury Region","A019 Other Livestock Farming","Geographic Units",648,
"2018","Canterbury Region","A020 Aquaculture","Geographic Units",24,
"2018","Canterbury Region","A015 Other Crop Growing","Geographic Units",690,
"2018","Canterbury Region","A016 Dairy Cattle Farming","Geographic Units",1680,
"2018","Canterbury Region","A017 Poultry Farming","Geographic Units",84,
"2018","Canterbury Region","A012 Mushroom and Vegetable Growing","Geographic Units",180,
"2018","Canterbury Region","A013 Fruit and Tree Nut Growing","Geographic Units",333,
"2018","Canterbury Region","A014 Sheep, Beef Cattle and Grain Farming","Geographic Units",4059,
"2018","Canterbury Region","S94 Repair and Maintenance","Geographic Units",1434,
"2018","Canterbury Region","S95 Personal and Other Services","Geographic Units",1752,
"2018","Canterbury Region","A011 Nursery and Floriculture Production","Geographic Units",162,
"2018","Canterbury Region","R90 Artistic Activities","Geographic Units",261,
"2018","Canterbury Region","R91 Sport and Recreation Activities","Geographic Units",978,
"2018","Canterbury Region","R92 Gambling Activities","Geographic Units",18,
"2018","Canterbury Region","Q86 Residential Care Services","Geographic Units",246,
"2018","Canterbury Region","Q87 Social Assistance Services","Geographic Units",348,
"2018","Canterbury Region","R89 Heritage Activities","Geographic Units",63,
"2018","Canterbury Region","P82 Adult, Community and Other Education","Geographic Units",513,
"2018","Canterbury Region","Q84 Hospitals","Geographic Units",45,
"2018","Canterbury Region","Q85 Medical and Other Health Care Services","Geographic Units",2274,
"2018","Canterbury Region","O77 Public Order, Safety and Regulatory Services","Geographic Units",354,
"2018","Canterbury Region","P80 Preschool and School Education","Geographic Units",675,
"2018","Canterbury Region","P81 Tertiary Education","Geographic Units",78,
"2018","Canterbury Region","N73 Building Cleaning, Pest Control and Other Support Services","Geographic Units",1062,
"2018","Canterbury Region","O75 Public Administration","Geographic Units",132,
"2018","Canterbury Region","O76 Defence","Geographic Units",9,
"2018","Canterbury Region","M69 Professional, Scientific and Technical Services (except Computer Systems Design and Related Services)","Geographic Units",5523,
"2018","Canterbury Region","M70 Computer System Design and Related Services","Geographic Units",933,
"2018","Canterbury Region","N72 Administrative Services","Geographic Units",1143,
"2018","Canterbury Region","K64 Auxiliary Finance and Insurance Services","Geographic Units",747,
"2018","Canterbury Region","L66 Rental and Hiring Services (except Real Estate)","Geographic Units",957,
"2018","Canterbury Region","L67 Property Operators and Real Estate Services","Geographic Units",14040,
"2018","Canterbury Region","J60 Library and Other Information Services","Geographic Units",45,
"2018","Canterbury Region","K62 Finance","Geographic Units",3528,
"2018","Canterbury Region","K63 Insurance and Superannuation Funds","Geographic Units",63,
"2018","Canterbury Region","J57 Internet Publishing and Broadcasting","Geographic Units",12,
"2018","Canterbury Region","J58 Telecommunications Services","Geographic Units",39,
"2018","Canterbury Region","J59 Internet Service Providers, Web Search Portals and Data Processing Services","Geographic Units",66,
"2018","Canterbury Region","J54 Publishing (except Internet and Music Publishing)","Geographic Units",99,
"2018","Canterbury Region","J55 Motion Picture and Sound Recording Activities","Geographic Units",138,
"2018","Canterbury Region","J56 Broadcasting (except Internet)","Geographic Units",21,
"2018","Canterbury Region","I51 Postal and Courier Pick-up and Delivery Services","Geographic Units",513,
"2018","Canterbury Region","I52 Transport Support Services","Geographic Units",207,
"2018","Canterbury Region","I53 Warehousing and Storage Services","Geographic Units",132,
"2018","Canterbury Region","I48 Water Transport","Geographic Units",9,
"2018","Canterbury Region","I49 Air and Space Transport","Geographic Units",45,
"2018","Canterbury Region","I50 Other Transport","Geographic Units",114,
"2018","Canterbury Region","H45 Food and Beverage Services","Geographic Units",2253,
"2018","Canterbury Region","I46 Road Transport","Geographic Units",1158,
"2018","Canterbury Region","I47 Rail Transport","Geographic Units",6,
"2018","Canterbury Region","G42 Other Store-Based Retailing","Geographic Units",2577,
"2018","Canterbury Region","G43 Non-Store Retailing and Retail Commission Based Buying and/or Selling","Geographic Units",315,
"2018","Canterbury Region","A Agriculture, Forestry and Fishing","Employee Count",16300,
"2018","Canterbury Region","B Mining","Employee Count",330,
"2018","Canterbury Region","C Manufacturing","Geographic Units",3147,
"2018","Canterbury Region","C Manufacturing","Employee Count",36000,
"2018","Canterbury Region","D Electricity, Gas, Water and Waste Services","Geographic Units",216,
"2018","Canterbury Region","D Electricity, Gas, Water and Waste Services","Employee Count",2150,
"2018","Canterbury Region","E Construction","Geographic Units",8976,
"2018","Canterbury Region","G Retail Trade","Geographic Units",4329,
"2018","Canterbury Region","G Retail Trade","Employee Count",30500,
"2018","Canterbury Region","H Accommodation and Food Services","Geographic Units",3096,
"2018","Canterbury Region","H Accommodation and Food Services","Employee Count",21300,
"2018","Canterbury Region","I Transport, Postal and Warehousing","Geographic Units",2184,
"2018","Canterbury Region","I Transport, Postal and Warehousing","Employee Count",13900,
"2018","Canterbury Region","J Information Media and Telecommunications","Geographic Units",423,
"2018","Canterbury Region","J Information Media and Telecommunications","Employee Count",3550,
"2018","Canterbury Region","K Financial and Insurance Services","Geographic Units",4338,
"2018","Canterbury Region","K Financial and Insurance Services","Employee Count",5300,
"2018","Canterbury Region","L Rental, Hiring and Real Estate Services","Geographic Units",14997,
"2018","Canterbury Region","M Professional, Scientific and Technical Services","Geographic Units",6459,
"2018","Canterbury Region","M Professional, Scientific and Technical Services","Employee Count",23100,
"2018","Canterbury Region","N Administrative and Support Services","Geographic Units",2205,
"2018","Canterbury Region","Total Industry","Employee Count",303600,
"2018","Canterbury Region","E Construction","Employee Count",30900,
"2018","Canterbury Region","F Wholesale Trade","Geographic Units",2766,
"2018","Canterbury Region","F Wholesale Trade","Employee Count",15800,
"2018","Canterbury Region","L Rental, Hiring and Real Estate Services","Employee Count",5000,
"2018","Canterbury Region","N Administrative and Support Services","Employee Count",15500,
"2018","Canterbury Region","O Public Administration and Safety","Geographic Units",495,
"2018","Canterbury Region","O Public Administration and Safety","Employee Count",12600,
"2018","Canterbury Region","P Education and Training","Geographic Units",1263,
"2018","Canterbury Region","P Education and Training","Employee Count",22900,
