"2018","Canterbury Region","L662 Farm Animal and Bloodstock Leasing","Employee Count",65,
"2018","Canterbury Region","L663 Other Goods and Equipment Rental and Hiring","Employee Count",930,
"2018","Canterbury Region","L664 Non-Financial Intangible Assets (Except Copyrights) Leasing","Employee Count",150,
"2018","Canterbury Region","L671 Property Operators","Employee Count",1200,
"2018","Canterbury Region","L672 Real Estate Services","Employee Count",1550,
"2018","Canterbury Region","M691 Scientific Research Services","Employee Count",1300,
"2018","Canterbury Region","M692 Architectural, Engineering and Technical Services","Employee Count",7400,
"2018","Canterbury Region","M694 Advertising Services","Employee Count",380,
"2018","Canterbury Region","M696 Management and Related Consulting Services","Employee Count",4250,
"2018","Canterbury Region","M700 Computer System Design and Related Services","Employee Count",4000,
"2018","Canterbury Region","N721 Employment Services","Employee Count",8800,
"2018","Canterbury Region","N722 Travel Agency Services","Employee Count",950,
"2018","Canterbury Region","N729 Other Administrative Services","Employee Count",1650,
"2018","Canterbury Region","N731 Building Cleaning, Pest Control and Gardening Services","Employee Count",3850,
"2018","Canterbury Region","N732 Packaging and Labelling Services","Employee Count",300,
"2018","Canterbury Region","O751 Central Government Administration","Employee Count",2950,
"2018","Canterbury Region","O753 Local Government Administration","Employee Count",3100,
"2018","Canterbury Region","O754 Justice","Employee Count",390,
"2018","Canterbury Region","O760 Defence","Employee Count",1200,
"2018","Canterbury Region","O771 Public Order and Safety Services","Employee Count",4250,
"2018","Canterbury Region","O772 Regulatory Services","Employee Count",730,
"2018","Canterbury Region","P801 Preschool Education","Employee Count",3750,
"2018","Canterbury Region","P821 Adult, Community and Other Education","Employee Count",1450,
"2018","Canterbury Region","Q853 Allied Health Services","Employee Count",4150,
"2018","Canterbury Region","Q859 Other Health Care Services","Employee Count",1950,
"2018","Canterbury Region","Q860 Residential Care Services","Employee Count",9200,
"2018","Canterbury Region","Q871 Child Care Services","Employee Count",1150,
"2018","Canterbury Region","Q879 Other Social Assistance Services","Employee Count",2000,
"2018","Canterbury Region","R891 Museum Operation","Employee Count",310,
"2018","Canterbury Region","R892 Parks and Gardens Operations","Employee Count",500,
"2018","Canterbury Region","S942 Machinery and Equipment Repair and Maintenance","Employee Count",600,
"2018","Canterbury Region","S949 Other Repair and Maintenance","Employee Count",120,
"2018","Canterbury Region","S951 Personal Care Services","Employee Count",1550,
"2018","Canterbury Region","M693 Legal and Accounting Services","Employee Count",4300,
"2018","Canterbury Region","M695 Market Research and Statistical Services","Employee Count",350,
"2018","Canterbury Region","M697 Veterinary Services","Employee Count",890,
"2018","Canterbury Region","M699 Other Professional, Scientific and Technical Services","Employee Count",250,
"2018","Canterbury Region","P802 School Education","Employee Count",12200,
"2018","Canterbury Region","P810 Tertiary Education","Employee Count",5300,
"2018","Canterbury Region","P822 Educational Support Services","Employee Count",170,
"2018","Canterbury Region","Q840 Hospitals","Employee Count",11600,
"2018","Canterbury Region","Q851 Medical Services","Employee Count",2450,
"2018","Canterbury Region","Q852 Pathology and Diagnostic Imaging Services","Employee Count",930,
"2018","Canterbury Region","R900 Creative and Performing Arts Activities","Employee Count",340,
"2018","Canterbury Region","R911 Sport and Physical Recreation Activities","Employee Count",2500,
"2018","Canterbury Region","R912 Horse and Dog Racing Activities","Employee Count",710,
"2018","Canterbury Region","R913 Amusement and Other Recreation Activities","Employee Count",350,
"2018","Canterbury Region","R920 Gambling Activities","Employee Count",640,
"2018","Canterbury Region","S941 Automotive Repair and Maintenance","Employee Count",3100,
"2018","Canterbury Region","S952 Funeral, Crematorium and Cemetery Services","Employee Count",170,
"2018","Canterbury Region","S953 Other Personal Services","Employee Count",960,
"2018","Canterbury Region","S954 Religious Services","Employee Count",1350,
"2018","Canterbury Region","S955 Civic, Professional and Other Interest Group Services","Employee Count",1700,
